CC BY-4.0,"Life expectancy at birth, total (years)",Life expectancy at birth indicates the number of years a newborn infant would live if prevailing patterns of mortality at the time of its birth were to stay the same throughout its life.,"(1) United Nations Population Division. World Population Prospects: 2019 Revision, or derived from male and female life expectancy at birth from sources such as: (2) Census reports and other statistical publications from national statistical offices, (3) Eurostat: Demographic Statistics, (4) United Nations Statistical Division. Population and Vital Statistics Reprot (various years), (5) U.S. Census Bureau: International Database, and (6) Secretariat of the Pacific Community: Statistics and Demography Programme.",Health: Mortality,,Annual,Weighted average,"Life expectancy at birth used here is the average number of years a newborn is expected to live if mortality patterns at the time of its birth remain constant in the future. It reflects the overall mortality level of a population, and summarizes the mortality pattern that prevails across all age groups in a given year. It is calculated in a period life table which provides a snapshot of a population's mortality pattern at a given time. It therefore does not reflect the mortality pattern that a person actually experiences during his/her life, which can be calculated in a cohort life table.

High mortality in young age groups significantly lowers the life expectancy at birth. But if a person survives his/her childhood of high mortality, he/she may live much longer. For example, in a population with a life expectancy at birth of 50, there may be few people dying at age 50. The life expectancy at birth may be low due to the high childhood mortality so that once a person survives his/her childhood, he/she may live much longer than 50 years.","Mortality rates for different age groups (infants, children, and adults) and overall mortality indicators (life expectancy at birth or survival to a given age) are important indicators of health status in a country. Because data on the incidence and prevalence of diseases are frequently unavailable, mortality rates are often used to identify vulnerable populations. And they are among the indicators most frequently used to compare socioeconomic development across countries.",Annual data series from United Nations Population Division's World Population Prospects are interpolated data from 5-year period data. Therefore they may not reflect real events as much as observed data.,,https://datacatalog.worldbank.org/public-licenses#cc-by,,,,,,
Use and distribution of these data are subject to Stockholm International Peace Research Institute (SIPRI) terms and conditions.,Military expenditure (% of GDP),"Military expenditures data from SIPRI are derived from the NATO definition, which includes all current and capital expenditures on the armed forces, including peacekeeping forces; defense ministries and other government agencies engaged in defense projects; paramilitary forces, if these are judged to be trained and equipped for military operations; and military space activities. Such expenditures include military and civil personnel, including retirement pensions of military personnel and social services for personnel; operation and maintenance; procurement; military research and development; and military aid (in the military expenditures of the donor country). Excluded are civil defense and current expenditures for previous military activities, such as for veterans' benefits, demobilization, conversion, and destruction of weapons. This definition cannot be applied for all countries, however, since that would require much more detailed information than is available about what is included in military budgets and off-budget military expenditure items. (For example, military budgets might or might not cover civil defense, reserves and auxiliary forces, police and paramilitary forces, dual-purpose forces such as military and civilian police, military grants in kind, pensions for military personnel, and social security contributions paid by one part of government to another.)","Stockholm International Peace Research Institute (SIPRI), Yearbook: Armaments, Disarmament and International Security.",Public Sector: Defense & arms trade,,Annual,Weighted average,"SIPRI military expenditure data includes military and civil personnel, including retirement pensions and social services for military personnel; operation and maintenance; procurement; military research and development; and military aid (in the military expenditures of the donor country). Excluded are civil defense and current expenditures for previous military activities, such as for veterans' benefits, demobilization, and weapons conversion and destruction. This definition cannot be applied for all countries, however, since that would require more detailed information than is available about military budgets and off-budget military expenditures (for example, whether military budgets cover civil defense, reserves and auxiliary forces, police and paramilitary forces, and military pensions).

SIPRI data for the most recent years include two types of estimate which apply to all countries: (a) figures for the most recent years are for adopted budgets, budget estimates or revised estimates, and are revised, more often than not, in subsequent years; and (b) the deflator used for the latest year in the series is an estimate SIPRI's primary source of military expenditure data is official data provided by national governments. These data are derived from budget documents, defense white papers, and other public documents from official government agencies, including government responses to questionnaires sent by SIPRI, the UNODA, or the Organization for Security and Co-operation in Europe. Secondary sources include international statistics, such as those of NATO and the IMF's Government Finance Statistics Yearbook. Other secondary sources include country reports of the Economist Intelligence Unit, country reports by IMF staff, and specialist journals and newspapers.

The data on military expenditures as a share of GDP are SIPRI estimates. The SIPRI military expenditure figures are presented on a calendar-year basis. The only exception is the USA, for which statistics report data on a fiscal-year basis. Calendar-year data are calculated on the assumption of an even rate of expenditure throughout the fiscal year. The ratio of military expenditure to GDP is calculated in domestic currency at current prices and for calendar years.

The SIPRI military expenditure figures are presented on a calendar-year basis. The only exception is the USA, for which statistics report data on a fiscal-year basis. Calendar-year data are calculated on the assumption of an even rate of expenditure throughout the fiscal year.","Although national defense is an important function of government and security from external threats that contributes to economic development, high military expenditures for defense or civil conflicts burden the economy and may impede growth. Data on military expenditures as a share of gross domestic product (GDP) are a rough indicator of the portion of national resources used for military activities and of the burden on the economy.

Data on military expenditures as a share of gross domestic product (GDP) are a rough indicator of the portion of national resources used for military activities and of the burden on the economy. As an input"" measure military expenditures are not directly related to the ""output"" of military activities", capabilities, or security. Comparisons of military spending among countries should take into account the many factors that influence perceptions of vulnerability and risk, including historical and cultural traditions, the length of borders that need defending, the quality of relations with neighbors," and the role of the armed forces in the body politic.""","Data on military expenditures are not compiled using standard definitions and are often incomplete and unreliable due to countries' reluctance to disclose military information. Even in countries where the parliament vigilantly reviews budgets and spending, military expenditures and arms transfers rarely receive close scrutiny or full, public disclosure (see Ball 1984 and Happe and Wakeman-Linn 1994). However, the Stockholm International Peace Research Institute (SIPRI) has adopted a definition of military expenditure derived from the North Atlantic Treaty Organization's (NATO) former definition (in use until 2002; see Definitions).

In the many cases where SIPRI cannot make independent estimates, it uses the national data provided. Because of the differences in definitions and the difficulty in verifying the accuracy and completeness of data, data on military expenditures are not always comparable across countries. However, SIPRI puts a high priority on ensuring that the data series for each country is comparable over time.",Data for some countries are based on partial or uncertain data or rough estimates.,https://www.sipri.org/about/terms-and-conditions
