License Type,Indicator Name,Long definition,Source,Topic,Unit of measure,Periodicity,Aggregation method,Statistical concept and methodology,Development relevance,Limitations and exceptions,General comments,License URL,,,,,,
CC BY-4.0,GDP (current US$),"GDP at purchaser's prices is the sum of gross value added by all resident producers in the economy plus any product taxes and minus any subsidies not included in the value of the products. It is calculated without making deductions for depreciation of fabricated assets or for depletion and degradation of natural resources. Data are in current U.S. dollars. Dollar figures for GDP are converted from domestic currencies using single year official exchange rates. For a few countries where the official exchange rate does not reflect the rate effectively applied to actual foreign exchange transactions, an alternative conversion factor is used.","World Bank national accounts data, and OECD National Accounts data files.",Economic Policy & Debt: National accounts: US$ at current prices: Aggregate indicators,,Annual,Gap-filled total,"Gross domestic product (GDP) represents the sum of value added by all its producers. Value added is the value of the gross output of producers less the value of intermediate goods and services consumed in production, before accounting for consumption of fixed capital in production. The United Nations System of National Accounts calls for value added to be valued at either basic prices (excluding net taxes on products) or producer prices (including net taxes on products paid by producers but excluding sales or value added taxes). Both valuations exclude transport charges that are invoiced separately by producers. Total GDP is measured at purchaser prices. Value added by industry is normally measured at basic prices.",,"Gross domestic product (GDP), though widely tracked, may not always be the most relevant summary of aggregated economic performance for all economies, especially when production occurs at the expense of consuming capital stock.

While GDP estimates based on the production approach are generally more reliable than estimates compiled from the income or expenditure side, different countries use different definitions, methods, and reporting standards. World Bank staff review the quality of national accounts data and sometimes make adjustments to improve consistency with international guidelines. Nevertheless, significant discrepancies remain between international standards and actual practice. Many statistical offices, especially those in developing countries, face severe limitations in the resources, time, training, and budgets required to produce reliable and comprehensive series of national accounts statistics.

Among the difficulties faced by compilers of national accounts is the extent of unreported economic activity in the informal or secondary economy. In developing countries a large share of agricultural output is either not exchanged (because it is consumed within the household) or not exchanged for money.",,https://datacatalog.worldbank.org/public-licenses#cc-by,,,,,,
CC BY-4.0,GDP growth (annual %),"Annual percentage growth rate of GDP at market prices based on constant local currency. Aggregates are based on constant 2015 prices, expressed in U.S. dollars. GDP is the sum of gross value added by all resident producers in the economy plus any product taxes and minus any subsidies not included in the value of the products. It is calculated without making deductions for depreciation of fabricated assets or for depletion and degradation of natural resources.","World Bank national accounts data, and OECD National Accounts data files.",Economic Policy & Debt: National accounts: Growth rates,,Annual,Weighted average,"Gross domestic product (GDP) represents the sum of value added by all its producers. Value added is the value of the gross output of producers less the value of intermediate goods and services consumed in production, before accounting for consumption of fixed capital in production. The United Nations System of National Accounts calls for value added to be valued at either basic prices (excluding net taxes on products) or producer prices (including net taxes on products paid by producers but excluding sales or value added taxes). Both valuations exclude transport charges that are invoiced separately by producers. Total GDP is measured at purchaser prices. Value added by industry is normally measured at basic prices. When value added is measured at producer prices.

Growth rates of GDP and its components are calculated using the least squares method and constant price data in the local currency. Constant price in U.S. dollar series are used to calculate regional and income group growth rates. Local currency series are converted to constant U.S. dollars using an exchange rate in the common reference year.","An economy's growth is measured by the change in the volume of its output or in the real incomes of its residents. The 2008 United Nations System of National Accounts (2008 SNA) offers three plausible indicators for calculating growth: the volume of gross domestic product (GDP), real gross domestic income, and real gross national income. The volume of GDP is the sum of value added, measured at constant prices, by households, government, and industries operating in the economy. GDP accounts for all domestic production, regardless of whether the income accrues to domestic or foreign institutions.","Each industry's contribution to growth in the economy's output is measured by growth in the industry's value added. In principle, value added in constant prices can be estimated by measuring the quantity of goods and services produced in a period, valuing them at an agreed set of base year prices, and subtracting the cost of intermediate inputs, also in constant prices. This double-deflation method requires detailed information on the structure of prices of inputs and outputs.

In many industries, however, value added is extrapolated from the base year using single volume indexes of outputs or, less commonly, inputs. Particularly in the services industries, including most of government, value added in constant prices is often imputed from labor inputs, such as real wages or number of employees. In the absence of well defined measures of output, measuring the growth of services remains difficult.

Moreover, technical progress can lead to improvements in production processes and in the quality of goods and services that, if not properly accounted for, can distort measures of value added and thus of growth. When inputs are used to estimate output, as for nonmarket services, unmeasured technical progress leads to underestimates of the volume of output. Similarly, unmeasured improvements in quality lead to underestimates of the value of output and value added. The result can be underestimates of growth and productivity improvement and overestimates of inflation.

Informal economic activities pose a particular measurement problem, especially in developing countries, where much economic activity is unrecorded. A complete picture of the economy requires estimating household outputs produced for home use, sales in informal markets, barter exchanges, and illicit or deliberately unreported activities. The consistency and completeness of such estimates depend on the skill and methods of the compiling statisticians.

Rebasing of national accounts can alter the measured growth rate of an economy and lead to breaks in series that affect the consistency of data over time. When countries rebase their national accounts, they update the weights assigned to various components to better reflect current patterns of production or uses of output. The new base year should represent normal operation of the economy - it should be a year without major shocks or distortions. Some developing countries have not rebased their national accounts for many years. Using an old base year can be misleading because implicit price and volume weights become progressively less relevant and useful.

To obtain comparable series of constant price data for computing aggregates, the World Bank rescales GDP and value added by industrial origin to a common reference year. Because rescaling changes the implicit weights used in forming regional and income group aggregates, aggregate growth rates are not comparable with those from earlier editions with different base years. Rescaling may result in a discrepancy between the rescaled GDP and the sum of the rescaled components. To avoid distortions in the growth rates, the discrepancy is left unallocated. As a result, the weighted average of the growth rates of the components generally does not equal the GDP growth rate.",,https://datacatalog.worldbank.org/public-licenses#cc-by,,,,,,
CC BY-4.0,GDP per capita (current US$),GDP per capita is gross domestic product divided by midyear population. GDP is the sum of gross value added by all resident producers in the economy plus any product taxes and minus any subsidies not included in the value of the products. It is calculated without making deductions for depreciation of fabricated assets or for depletion and degradation of natural resources. Data are in current U.S. dollars.,"World Bank national accounts data, and OECD National Accounts data files.",Economic Policy & Debt: National accounts: US$ at current prices: Aggregate indicators,,Annual,Weighted Average,"For more information, see the metadata for current U.S. dollar GDP (NY.GDP.MKTP.CD) and total population (SP.POP.TOTL).",,,,https://datacatalog.worldbank.org/public-licenses#cc-by,,,,,,
CC BY-4.0,Gini index (World Bank estimate),"Gini index measures the extent to which the distribution of income (or, in some cases, consumption expenditure) among individuals or households within an economy deviates from a perfectly equal distribution. A Lorenz curve plots the cumulative percentages of total income received against the cumulative number of recipients, starting with the poorest individual or household. The Gini index measures the area between the Lorenz curve and a hypothetical line of absolute equality, expressed as a percentage of the maximum area under the line. Thus a Gini index of 0 represents perfect equality, while an index of 100 implies perfect inequality.","World Bank, Development Research Group. Data are based on primary household survey data obtained from government statistical agencies and World Bank country departments. For more information and methodology, please see PovcalNet (http://iresearch.worldbank.org/PovcalNet/index.htm).",Poverty: Income distribution,%,Annual,,"The Gini index measures the area between the Lorenz curve and a hypothetical line of absolute equality, expressed as a percentage of the maximum area under the line. A Lorenz curve plots the cumulative percentages of total income received against the cumulative number of recipients, starting with the poorest individual. Thus a Gini index of 0 represents perfect equality, while an index of 100 implies perfect inequality.

The Gini index provides a convenient summary measure of the degree of inequality. Data on the distribution of income or consumption come from nationally representative household surveys. Where the original data from the household survey were available, they have been used to calculate the income or consumption shares by quintile. Otherwise, shares have been estimated from the best available grouped data.

The distribution data have been adjusted for household size, providing a more consistent measure of per capita income or consumption. No adjustment has been made for spatial differences in cost of living within countries, because the data needed for such calculations are generally unavailable. For further details on the estimation method for low- and middle-income economies, see Ravallion and Chen (1996).

Survey year is the year in which the underlying household survey data were collected or, when the data collection period bridged two calendar years, the year in which most of the data were collected.",,"Gini coefficients are not unique. It is possible for two different Lorenz curves to give rise to the same Gini coefficient. Furthermore it is possible for the Gini coefficient of a developing country to rise (due to increasing inequality of income) while the number of people in absolute poverty decreases. This is because the Gini coefficient measures relative, not absolute, wealth.

Another limitation of the Gini coefficient is that it is not additive across groups, i.e. the total Gini of a society is not equal to the sum of the Gini's for its sub-groups. Thus, country-level Gini coefficients cannot be aggregated into regional or global Gini's, although a Gini coefficient can be computed for the aggregate.

Because the underlying household surveys differ in methods and types of welfare measures collected, data are not strictly comparable across countries or even across years within a country. Two sources of non-comparability should be noted for distributions of income in particular. First, the surveys can differ in many respects, including whether they use income or consumption expenditure as the living standard indicator. The distribution of income is typically more unequal than the distribution of consumption. In addition, the definitions of income used differ more often among surveys. Consumption is usually a much better welfare indicator, particularly in developing countries. Second, households differ in size (number of members) and in the extent of income sharing among members. And individuals differ in age and consumption needs. Differences among countries in these respects may bias comparisons of distribution. 

World Bank staff have made an effort to ensure that the data are as comparable as possible. Wherever possible, consumption has been used rather than income. Income distribution and Gini indexes for high-income economies are calculated directly from the Luxembourg Income Study database, using an estimation method consistent with that applied for developing countries.","The World Bank’s internationally comparable poverty monitoring database now draws on income or detailed consumption data from more than one thousand six hundred household surveys across 164 countries in six regions and 25 other high income countries (industrialized economies). While income distribution data are published for all countries with data available, poverty data are published for low- and middle-income countries and countries eligible to receive loans from the World Bank (such as Chile) and recently graduated countries (such as Estonia) only. See PovcalNet (http://iresearch.worldbank.org/PovcalNet/WhatIsNew.aspx) for definitions of geographical regions and industrialized countries.",https://datacatalog.worldbank.org/public-licenses#cc-by,,,,,,
CC BY-4.0,Individuals using the Internet (% of population),"Internet users are individuals who have used the Internet (from any location) in the last 3 months. The Internet can be used via a computer, mobile phone, personal digital assistant, games machine, digital TV etc.",International Telecommunication Union (ITU) World Telecommunication/ICT Indicators Database,Infrastructure: Communications,,Annual,Weighted average,"The Internet is a world-wide public computer network. It provides access to a number of communication services including the World Wide Web and carries email, news, entertainment and data files, irrespective of the device used (not assumed to be only via a computer - it may also be by mobile phone, PDA, games machine, digital TV etc.). Access can be via a fixed or mobile network. For additional/latest information on sources and country notes, please also refer to: https://www.itu.int/en/ITU-D/Statistics/Pages/stat/default.aspx","The digital and information revolution has changed the way the world learns, communicates, does business, and treats illnesses. New information and communications technologies (ICT) offer vast opportunities for progress in all walks of life in all countries - opportunities for economic growth, improved health, better service delivery, learning through distance education, and social and cultural advances.

Today's smartphones and tablets have computer power equivalent to that of yesterday's computers and provide a similar range of functions. Device convergence is thus rendering the conventional definition obsolete.

Comparable statistics on access, use, quality, and affordability of ICT are needed to formulate growth-enabling policies for the sector and to monitor and evaluate the sector's impact on development. Although basic access data are available for many countries, in most developing countries little is known about who uses ICT; what they are used for (school, work, business, research, government); and how they affect people and businesses. The global Partnership on Measuring ICT for Development is helping to set standards, harmonize information and communications technology statistics, and build statistical capacity in developing countries. However, despite significant improvements in the developing world, the gap between the ICT haves and have-nots remains.","Operators have traditionally been the main source of telecommunications data, so information on subscriptions has been widely available for most countries. This gives a general idea of access, but a more precise measure is the penetration rate - the share of households with access to telecommunications. During the past few years more information on information and communication technology use has become available from household and business surveys. Also important are data on actual use of telecommunications services. Ideally, statistics on telecommunications (and other information and communications technologies) should be compiled for all three measures: subscriptions, access, and use. The quality of data varies among reporting countries as a result of differences in regulations covering data provision and availability.

Discrepancies may also arise in cases where the end of a fiscal year differs from that used by ITU, which is the end of December of every year. A number of countries have fiscal years that end in March or June of every year.",Please cite the International Telecommunication Union for third-party use of these data.,https://datacatalog.worldbank.org/public-licenses#cc-by,,,,,,
CC BY-4.0,Interest payments (% of expense),"Interest payments include interest payments on government debt--including long-term bonds, long-term loans, and other debt instruments--to domestic and foreign residents.","International Monetary Fund, Government Finance Statistics Yearbook and data files.",Public Sector: Government finance: Expense,,Annual,Median,"The IMF's Government Finance Statistics Manual 2014, harmonized with the 2008 SNA, recommends an accrual accounting method, focusing on all economic events affecting assets, liabilities, revenues, and expenses, not just those represented by cash transactions. It accounts for all changes in stocks, so stock data at the end of an accounting period equal stock data at the beginning of the period plus flows over the period. The 1986 manual considered only debt stocks.

Government finance statistics are reported in local currency. Many countries report government finance data by fiscal year; see country metadata for information on fiscal year end by country.",,"For most countries central government finance data have been consolidated into one account, but for others only budgetary central government accounts are available. Countries reporting budgetary data are noted in the country metadata. Because budgetary accounts may not include all central government units (such as social security funds), they usually provide an incomplete picture. In federal states the central government accounts provide an incomplete view of total public finance.

Data on government revenue and expense are collected by the IMF through questionnaires to member countries and by the Organisation for Economic Co-operation and Development (OECD). Despite IMF efforts to standardize data collection, statistics are often incomplete, untimely, and not comparable across countries.",,https://datacatalog.worldbank.org/public-licenses#cc-by,,,,,,
CC BY-4.0,Interest payments (% of revenue),"Interest payments include interest payments on government debt--including long-term bonds, long-term loans, and other debt instruments--to domestic and foreign residents.","International Monetary Fund, Government Finance Statistics Yearbook and data files.",Public Sector: Government finance: Expense,,Annual,Median,"The IMF's Government Finance Statistics Manual 2014, harmonized with the 2008 SNA, recommends an accrual accounting method, focusing on all economic events affecting assets, liabilities, revenues, and expenses, not just those represented by cash transactions. It accounts for all changes in stocks, so stock data at the end of an accounting period equal stock data at the beginning of the period plus flows over the period. The 1986 manual considered only debt stocks.

Government finance statistics are reported in local currency. Many countries report government finance data by fiscal year; see country metadata for information on fiscal year end by country.",,"For most countries central government finance data have been consolidated into one account, but for others only budgetary central government accounts are available. Countries reporting budgetary data are noted in the country metadata. Because budgetary accounts may not include all central government units (such as social security funds), they usually provide an incomplete picture. In federal states the central government accounts provide an incomplete view of total public finance.

Data on government revenue and expense are collected by the IMF through questionnaires to member countries and by the Organisation for Economic Co-operation and Development (OECD). Despite IMF efforts to standardize data collection, statistics are often incomplete, untimely, and not comparable across countries.",,https://datacatalog.worldbank.org/public-licenses#cc-by,,,,,,
CC BY-4.0,Land area (sq. km),"Land area is a country's total area, excluding area under inland water bodies, national claims to continental shelf, and exclusive economic zones. In most cases the definition of inland water bodies includes major rivers and lakes.","Food and Agriculture Organization, electronic files and web site.",Environment: Land use,,Annual,Sum,Total land area does not include inland water bodies such as major rivers and lakes. Variations from year to year may be due to updated or revised data rather than to change in area.,"Land area is particularly important for understanding an economy's agricultural capacity and the environmental effects of human activity. Innovations in satellite mapping and computer databases have resulted in more precise measurements of land and water areas.

Population, land area, income, and output are basic measures of the size of an economy. They also provide a broad indication of actual and potential resources. Land area is therefore used as one of the major indicator to normalize other indicators.","The data are collected by the Food and Agriculture Organization (FAO) of the United Nations through annual questionnaires. The FAO tries to impose standard definitions and reporting methods, but complete consistency across countries and over time is not possible.

The data collected from official national sources through the questionnaire are supplemented with information from official secondary data sources. The secondary sources cover official country data from websites of national ministries, national publications and related country data reported by various international organizations.",,https://datacatalog.worldbank.org/public-licenses#cc-by,,,,,,
